{
  "schemaVersion": "0.2.0",
  "id": "revision_20260813T122955204Z_77c4c21ccab549a6bec195810779ca31",
  "reviewId": "review_example_architecture",
  "createdAt": "2026-08-13T12:29:55.204Z",
  "createdBy": {
    "id": "mirek",
    "displayName": "Mirek"
  },
  "rootDocument": "architecture.md",
  "documents": [
    {
      "path": "architecture.md",
      "digest": "sha256:c6f542da2618e36672b48c7e07a2cb6553cef11d9fa5e5ae4b223d1ac7c62a1e",
      "blobPath": ".review/blobs/sha256/c6/c6f542da2618e36672b48c7e07a2cb6553cef11d9fa5e5ae4b223d1ac7c62a1e",
      "mediaType": "text/markdown",
      "byteLength": 797
    }
  ],
  "resources": [
    {
      "id": "resource_ab5178d1de3673e9a0075e75",
      "document": "architecture.md",
      "originalReference": "assets/review-flow.svg",
      "sourceKind": "workspace",
      "role": "image",
      "alt": "Local-first review flow",
      "capturedAt": "2026-08-13T12:29:55.204Z",
      "digest": "sha256:84b689118b638cd47796fc03c1f6f8bad4220104bda91177d386a8798b81b373",
      "blobPath": ".review/blobs/sha256/84/84b689118b638cd47796fc03c1f6f8bad4220104bda91177d386a8798b81b373",
      "mediaType": "image/svg+xml",
      "byteLength": 1704
    }
  ],
  "externalReferences": [
    {
      "id": "reference_89ed070fcd2d002773e5e67f",
      "document": "architecture.md",
      "uri": "https://spec.commonmark.org/0.31.2/",
      "label": "CommonMark specification",
      "relation": "link"
    }
  ],
  "mermaidDiagrams": [
    {
      "id": "diagram_4415674329b1049104f07315",
      "document": "architecture.md",
      "ordinal": 0,
      "sourceDigest": "sha256:71b6ac7263513960c5df672453aeed7faaf6b1da4c6196f690fbb9480a3e94cc",
      "source": "flowchart LR\n    A[Markdown workspace] --> B[Immutable revision]\n    B --> C[Rendered review]\n    C --> D[Audit PDF]"
    }
  ],
  "diagnostics": [],
  "renderer": {
    "markdownProfile": "commonmark-gfm",
    "mermaidVersion": "11.10.1"
  }
}
